ID	LANG	TEXT	CONSTR
7417	EN	These fits would pass, but all the same, since he had them, he could not continue in his former occupation, and so the master of ceremonies retired and started living on his savings, which, by his modest reckoning, were enough to last him fifteen years.	lexical
7417	DE	Diese Anfälle gingen vorüber, aber er konnte doch seinen früheren Beruf nicht mehr ausüben. So setzte er sich zur Ruhe und lebte von seinen Ersparnissen, die nach seiner vorsichtigen Schätzung fünfzehn Jahre reichen mußten.	mußten
7417	IT	Questi attacchi passavano, eppure, quando c'erano, non ci si poteva occupare del solito lavoro, e il presentatore si ritirò dalla sua attività, e si mise a vivere dei suoi risparmi che, secondo il suo modesto calcolo, dovevano bastargli per quindici anni.	dovere
7417	ES	Estos ataques terminaban pasándosele, pero no le permitían dedicarse a su antiguo trabajo y el presentador se retiró a vivir en paz, valiéndose de sus ahorros, que, según sus modestos cálculos, debían durarle unos quince años.	deber
7417	FR	Ces accès ne duraient pas, mais tant qu’ils duraient il n’était évidemment pas question pour Georges d’exercer son métier. Il se mit donc en congé et vécut de ses économies, lesquelles lui suffisaient, selon ses modestes estimations, pour vivre quinze ans.	missing
7417	UK	Напади ці минали, але все-таки за наявності їх колишнім ремеслом годі було жити, і конферансьє пішов на спочинок і став жити на свої заощадження, котрих, на його скромний обрахунок, має вистачити йому на п’ятнадцять років.	вистачити
101	RU	– Взять бы этого Канта, да за такие доказательства года на три в Соловки! – совершенно неожиданно бухнул Иван Николаевич. – Иван! – сконфузившись, шепнул Берлиоз.	conditional
101	EN	They ought to take this Kant and give him a three-year stretch in Solovki for such proofs!' Ivan Nikolaevich plumped quite unexpectedly. 'Ivan!' Berlioz whispered, embarrassed.	ought to
101	DE	''Für solche Beweise müßte man den Kant drei Jahre nach So-lowki verbannen!'' stieß Besdomny überraschend hervor. ''Aber Iwan!'' flüsterte Berlioz verlegen.	müßte
101	IT	- Bisognerebbe prendere questo Kant e spedirlo per un paio di annetti a Solovki ! - sparò Ivan Nikolaevi in modo del tutto inaspettato. - Ivan! - sussurrò confuso Berlioz.	bisognare
101	ES	—A ese Kant habría que encerrarle tres años en Solovkí —soltó de repente Iván Nikoláyevich. —¡Iván, por favor! —le susurró Berlioz azorado.	haber que
101	FR	– Votre Kant, avec ses preuves, je l’enverrais pour trois ans aux îles Solovki, Moi ! lança soudain Ivan Nikolaïevitch, tout à fait hors de propos.	lexical
101	UK	— Узяти б цього Канта, та за такі докази років на три до Соловків! — геть несподівано бовкнув Іван Миколайович. — Іване! — знічено прошепотів Берліоз.	conditional
294	RU	Первоначально он отнесся ко мне неприязненно и даже оскорблял меня, то есть думал, что оскорбляет, называя меня собакой, – тут арестант усмехнулся, – я лично не вижу ничего дурного в этом звере, чтобы обижаться на это слово...	infinitive
294	EN	He treated me hostilely at first and even insulted me - that is, thought he insulted me - by calling me a dog.' Here the prisoner smiled. `I personally see nothing bad about this animal, that I should be offended by this word...'	should
294	DE	Zuerst behandelte er mich feindselig und beleidigte mich gar, das heißt, er wähnte mich zu beleidigen, indem er mich Hund nannte.'' Der Gefangene lächelte. ''Ich finde nichts Häßliches an diesem Tier, um darüber beleidigt zu sein.''	infinitive
294	IT	Dapprima mi trattava con ostilità, ed era persino offensivo, cioè credeva di offendermi chiamandomi cane -. L'arrestato ridacchiò. - Personalmente non vedo nulla di male in quella bestia perché debba offendermi il suo nome...	dovere
294	ES	Primero me trató con hostilidad, incluso me insultó, mejor dicho, pensó que me insultaba llamándome perro —el detenido sonrió—. No veo nada malo en ese animal como para sentirse ofendido con su nombre.	infinitive
294	FR	Au début, il s’est montré plutôt hostile à mon égard, et il m’a même injurié… c’est-àdire qu’il a pensé m’injurier, en me traitant de chien. (Le détenu sourit.) Personnellement, je ne vois rien de mauvais dans cet animal, pour qu’on soit offensé par ce mot…	lexical
294	UK	Попервах він поставився до мене неприязно, і навіть ображав мене, тобто думав, що ображає, називаючи мене собакою, — тут арештант осміхнувся, — я особисто не бачу нічого негожого в цьому звірі, щоб ображатися на це слово…	infinitive
300	RU	Не зная, как ответить на это, секретарь счел нужным повторить улыбку Пилата.	нужный
300	EN	Not knowing how to reply to that, the secretary found it necessary to repeat Pilate's smile.	necessary
300	DE	Der Sekretär, der keine Antwort wußte, hielt es für angebracht, das Lächeln des Pilatus zu erwidern.	angebracht
300	IT	Non sapendo come rispondere, il segretario ritenne opportuno imitare il sorriso del procuratore.	lexical
300	ES	No sabiendo qué contestar, el secretario creyó oportuno imitar la sonrisa del procurador.	lexical
300	FR	Ne sachant que répondre, le secrétaire jugea bon, à tout hasard, de copier le sourire de Pilate.	juger bon
300	UK	Не знаючи, як відповісти на це, секретар визнав за потрібне повторити усмішку Пилата.	потрібне
318	RU	Ты не можешь даже и думать о чем-нибудь и мечтаешь только о том, чтобы пришла твоя собака, единственное, по-видимому, существо, к которому ты привязан.	conditional
318	EN	You can't even think about anything and only dream that your dog should come, apparently the one being you are attached to.	should
318	DE	Du kannst kaum noch einen Gedanken fassen und träumst nur davon, daß dein Hund kommt, offenbar das einzige Wesen, an dem du hängst.	conditional
318	IT	Non riesci neppure a pensare e sogni solo che venga il tuo cane, l'unico essere, evidentemente, al quale sei affezionato.	conditional
318	ES	Ni siquiera eres capaz de pensar en algo y lo único que deseas es que venga tu perro, que es, por lo visto, el único ser al que tienes cariño.	conditional
318	FR	Tu n’es même pas capable de penser à quoi que ce soit. Ton rêve est simplement d’avoir ton chien auprès de toi, le seul être, apparemment, auquel tu sois attaché.	conditional
318	UK	Ти не можеш навіть думати про що-небудь і мрієш тільки про те, щоб прийшов твій собака, єдина, певно, істота, до якої ти прив’язаний.	conditional
439	RU	– Я думаю, – странно усмехнувшись, ответил прокуратор, – что есть еще кое-кто на свете, кого тебе следовало бы пожалеть более, чем Иуду из Кириафа, и кому придется гораздо хуже, чем Иуде!	следовать
439	EN	'I think,' the procurator replied, grinning strangely, `that there is now someone else in the world for whom you ought to feel sorrier than' for Judas of Kiriath, and who is going to have it much worse than Judas! ...	ought to
439	DE	''Ich glaube'', antwortete der Prokurator mit seltsamem Lächeln, ''es gibt jemanden auf der Welt, der dich mehr dauern müßte als Judas aus Kirjath und dem weit Schlimmeres widerfahren wird als ihm!	müßte
439	IT	- Io credo, - rispose il procuratore con uno strano sogghigno, - che ci sia al mondo un'altra persona che ti dovrebbe fare piú compassione di Giuda di Kiriat, perché le toccherà una sorte ben peggiore di quella di Giuda!...	dovere
439	ES	—Me parece —dijo el procurador con sonrisa extraña— que hay alguien por quien deberías sentir mucha más lástima que por Judas de Kerioth; ¡alguien que lo va a pasar mucho peor que Judas!...	deber
439	FR	– Je pense, répondit le procurateur avec un sourire bizarre, qu’il y a quelqu’un, sur la terre, que tu devrais plaindre bien plus que Judas Iscariote, et à qui il arrivera des choses bien pires qu’à Judas !…	devoir
439	UK	— Гадаю, — дивно всміхнувшись, відповів прокуратор, — що є ще дехто на світі, за ким тобі варто було б пошкодувати ще більше, ніж за Юдою з Киріяту, і кому випаде куди гірше, ніж Юді!	варто було
532	RU	Не услышал бы нас кто-нибудь, игемон?	conditional
532	EN	What if we should be overheard, Hegemon?'	should
532	DE	Es hat uns doch nicht etwa jemand zugehört?''	missing
532	IT	Se ci sentisse qualcuno, egemone?	missing
532	ES	¿No nos estará escuchando alguien, hegémono?	missing
532	FR	Et si quelqu’un nous avait entendus, hegemon ?	missing
532	UK	Не почув би нас хто, ігемоне?	missing
1257	RU	Стоило только поднять голову от лампы вверх к небу, чтобы понять, что ночь пропала безвозвратно.	стоить
1257	EN	One needed only to raise one's head from the lamp to the sky to understand that the night was irretrievably lost.	need to
1257	DE	Er brauchte nur den Kopf vom Tischlämpchen gen Himmel zu heben, um zu begreifen, daß die Nacht unwiederbringlich dahin war.	brauchte
1257	IT	Bastava alzare la testa dalla lampadina e guardare il cielo per capire che la notte era irrevocabilmente perduta.	bastare
1257	ES	Bastaba levantar la cabeza, de la lamparita hacia el cielo, para darse cuenta de que la noche había terminado irremediablemente.	bastar
1257	FR	Il suffisait, au lieu de regarder la lampe, de lever les yeux vers le ciel pour se rendre compte que la nuit était partie sans retour.	il suffit
1257	UK	Досить лише підвести голову від лямпи угору до неба, щоб збагнути, що ніч згинула без вороття.	досить
1343	RU	Степа позвонил в московскую областную зрелищную комиссию и вопрос этот согласовал (Степа побледнел и заморгал глазами), подписал с профессором Воландом контракт на семь выступлений (Степа открыл рот), условился, что Воланд придет к нему для уточнения деталей в десять часов утра сегодня...	future
1343	EN	Styopa telephoned the Moscow Regional Entertainment Commission and had the question approved (Styopa turned pale and blinked),then signed a contract with Professor Woland for seven performances (Styopa opened his mouth),and arranged that Woland should come the next morning at ten o'clock to work out the details...	should
1343	DE	Stjopa habe die Moskauer Gebietstheaterkommission angerufen und die Frage abgestimmt (Stjopa klapperte erbleichend mit den Augen), dann habe er mit ihm, Professor Voland, einen Vertrag über sieben Auftritte abgeschlossen (Stjopa riß den Mund auf), ferner sei vereinbart worden, daß Voland ihn heute morgen um zehn aufsuchen solle, um noch ein paar Einzelheiten zu besprechen.	solle
1343	IT	Stepa aveva telefonato alla Commissione regionale moscovita per gli spettacoli, aveva avuto il benestare (Stepa impallidí e batté le palpebre) e aveva firmato col professor Woland un contratto per sette rappresentazioni (Stepa spalancò la bocca), erano rimasti intesi che il professore sarebbe venuto a trovarlo stamane alle dieci per mettere a punto i particolari...	lexical
1343	ES	Stiopa había llamado al Comité de Espectáculos de la zona de Moscú y había arreglado el asunto (al llegar aquí, Stiopa palideció y empezó a parpadear); luego le hizo a Voland un contrato para siete actuaciones (Stiopa abrió la boca) y le citó a las diez del día siguiente para ultimar detalles.	lexical
1343	FR	Stepan téléphona à la Commission des spectacles de la région de Moscou où il régla cette question (Stepan pâlit et battit des paupières), puis il signa avec le professeur Woland un contrat pour sept représentations (Stepan ouvrit la bouche), et convint avec Woland que celui-ci viendrait chez lui pour régler les détails, ce matin à dix heures…	future
1343	UK	Стьопа зателефонував до Московської обласної видовищної комісії й питання це узгодив (Стьопа сполотнів і закліпав очима), підписав з професором Воляндом контракт на сім виступів (Стьопа розтулив рота), умовився, що Волянд прийде до нього для уточнення подробиць о десятій годині ранку сьогодні…	future
1345	RU	Придя, был встречен домработницей Груней, которая объяснила, что сама она только что пришла, что она приходящая, что Берлиоза дома нет, а что если визитер желает видеть Степана Богдановича, то пусть идет к нему в спальню сам. Степан Богданович так крепко спит, что разбудить его она не берется. Увидев, в каком состоянии Степан Богданович, артист послал Груню в ближайший гастроном за водкой и закуской, в аптеку за льдом и... – Позвольте с вами рассчитаться, – проскулил убитый Степа и стал искать бумажник.	permissive
1345	EN	Having come, he was met by the housekeeper Grunya, who explained that she had just come herself, that she was not a live-in maid, that Berlioz was not home, and that if the visitor wished to see Stepan Bogdanovich, he should go to his bedroom himself. Stepan Bogdanovich was such a sound sleeper that she would not undertake to wake him up. Seeing what condition Stepan Bogdanovich was in, the artiste sent Grunya to the nearest grocery store for vodka and hors d'oeuvres, to the druggist's for ice, and... `Allow me to reimburse you,' the mortified Styopa squealed and began hunting for his wallet.	should
1345	DE	Beim Eintreten habe er das Hausmädchen Grunja getroffen, die ihm sagte, sie sei auch eben erst gekommen, sie sei nur tagsüber da, und Berlioz sei nicht zu Hause, und wenn der Besucher Ste-pan Bogdanowitsch sehen wolle, möge er selber ins Schlafzimmer gehen. Stepan Bogdanowitsch schlafe so fest, daß sie sich nicht zutraue, ihn zu wecken. Als er, der Artist Voland, sah, in welchem Zustand Stepan Bogdanowitsch war, habe er Grunja in den nächsten Feinkostladen geschickt, um Wodka und Zuspeise zu holen, und in die Apotheke nach Eis und . . . ''Was bin ich Ihnen denn schuldig?'' fiepte der niedergeschmetterte Stjopa kläglich und suchte nach seiner Brieftasche.	möge
1345	IT	Al suo arrivo, lo aveva accolto la domestica Grunja la quale gli aveva spiegato che era appena venuta anche lei, che lei veniva solo a ore, che Berlioz non era in casa, e che se il visitatore voleva vedere Stepan Bogdanovi , andasse pure in camera da letto: Stepan Bogdanovi dormiva cosí sodo che lei a svegliarlo non ce l'avrebbe fatta. Quando aveva visto lo stato di Stepan Bogdanovi , il mago aveva mandato Grunja nella piú vicina rosticceria a prendere la vodka e qualcosa da mangiare, quindi in farmacia per il ghiaccio e... - Mi permetta allora di regolare il conto, - piagnucolò Stepa, annientato, e si mise a cercare il portafoglio.	permissive
1345	ES	Al llegar a su casa le había recibido Grunia, quien le explicó que ella misma acababa de llegar porque no vivía allí; que Berlioz no estaba en casa y que, si el señor quería ver a Stepán Bogdánovich, pasara a su habitación, porque ella no se comprometía a despertarlo, y que luego, al ver el estado en que se hallaba Stepán, él mismo había mandado a Grunia a la tienda más próxima a comprar vodka y comida, y a la farmacia a buscar hielo y que entonces... —¡Permítame que le pague, por favor! —lloriqueó Stiopa, buscando su cartera, muerto de vergüenza.	permissive
1345	FR	En arrivant, il fut accueilli par Grounia, la bonne, qui lui expliqua qu’elle venait ellemême d’arriver pour faire le ménage, que Berlioz n’était pas là, et que, si le visiteur désirait voir Stepan Bogdanovitch, il n’avait qu’à aller directement dans sa chambre. Stepan Bogdanovitch dormait si profondément que, quant à elle, elle n’allait pas se risquer à le réveiller. Voyant dans quel état se trouvait Stepan Bogdanovitch, l’artiste envoya Grounia au magasin d’alimentation le plus proche, pour la vodka et les hors-d’œuvre, à la pharmacie pour la glace, et… – Permettez-moi de vous régler ce que je vous dois, gémit Stepan complètement abasourdi, et il se mit chercher son portefeuille.	avoir à
1345	UK	Прийшовши, він був зустрінутий покоївкою Грунею, яка пояснила, що сама вона допіру прийшла, що вона нахожа, що Берліоза вдома немає, а що як візитер воліє бачити Степана Богдановича, то нехай іде до нього до спальні сам. Степан Богданович так міцно спить, що розбудити його вона не береться. Побачивши, в якому стані Степан Богданович, артист послав Груню до найближчого гастроному по горілку та закуску, до аптеки по лід і… — Дозвольте з вами розрахуватися, — проскиглив вбитий Стьопа й став шукати гаманця.	?
1597	RU	– Хорошо-с, но самому-то зачем же бегать?	зачем
1597	EN	'Very good, sir, but why should you go running around yourself?	should
1597	DE	''Schön, schön, aber warum müssen Sie dazu selber losrennen?	müssen
1597	IT	- D'accordo, ma perché deve correre in giro proprio lei?	dovere
1597	ES	—De acuerdo, pero ¿por qué lo tiene que hacer precisamente usted?	tener que
1597	FR	– Certainement ! Mais pourquoi vous charger de tout, tout seul ?	pourqoui
1597	UK	— Гаразд, але самому ж бо навіщо бігати?	навіщо
1681	RU	Никанор Иванович в некотором недоумении возразил, что, мол, иностранцам полагается жить в «Метрополе», а вовсе не на частных квартирах...	полагаться
1681	EN	Nikanor Ivanovich, somewhat perplexed, objected that foreigners ought to live at the Metropol, and not in private apartments at all...	ought to
1681	DE	Nikanor Iwanowitsch erwiderte etwas unschlüssig, Ausländer müßten doch im ''Metropol'' wohnen, keineswegs in Privatquartieren ...	müßten
1681	IT	Nikanor Ivanovi replicò con una certa perplessità che gli stranieri dovrebbero risiedere al Métropole, non in appartamenti privati...	dovere
1681	ES	Nikanor Ivánovich estaba algo desconcertado. Alegó que los extranjeros tenían que vivir en el Metropol, no en casas particulares.	tener que
1681	FR	Perplexe, Nicanor Ivanovitch objecta que, normalement, les étrangers devaient loger au Métropole, et jamais dans des appartements particuliers…	devoir
1681	UK	Никанор Іванович з деяким ваганням заперечив, що, мовляв, іноземцям належить жити в «Метрополі», а ніяк не на приватних квартирах.	належати
1697	RU	Если б вы видели, какая у него вилла в Ницце!	conditional
1697	EN	You should see the villa he's got in Nice!	should
1697	DE	Sie müßten mal seine Villa in Nizza sehen!	müßen
1697	IT	Se vedesse che villa possiede a Nizza!	conditional
1697	ES	¡Si viera el chalet que tiene en Niza!	conditional
1697	FR	Si vous voyiez la villa qu’il possède à Nice !	conditional
1697	UK	Якби ви бачили, яку він має віллу в Ніцці!	conditional
1733	RU	– Мессир, вам стоит это приказать!.. – отозвался откуда-то Коровьев, но не дребезжащим, а очень чистым и звучным голосом.	стоить
1733	EN	'Messire, you have only to say the word...' Koroviev responded from somewhere, not in a rattling but in a very clear and resounding voice.	have to
1733	DE	''Ihr braucht nur zu befehlen, Messere'', antwortete Korowjew von irgendwoher, doch nicht mehr mit klirrender, sondern mit sehr klarer und klangvoller Stimme.	brauchen
1733	IT	- Messere, basta che lei ordini... - replicò Korov'ev, con una voce non piú tremolante ma limpida e sonora.	bastare
1733	ES	—Messere, bastaría con una orden suya... —respondió Koróviev, pero con una voz no cascada, sino limpia y sonora.	bastar
1733	FR	– Messire, il vous suffit d’ordonner…, répondit Koroviev on ne sait d’où, et d’une voix qui, loin de chevroter, était au contraire nette et sonore.	il suffit
1733	UK	— Мессіре, вам досить лиш це наказати!.. — озвався звідкілясь Коров’єв, але не брязкучим, а дуже чистим і лунким голосом.	досить
1846	RU	– Не отвечает квартира, – сказал Варенуха, кладя трубку на рычаг, – попробовать разве позвонить еще...	infinitive
1846	EN	The apartment doesn't answer,' Varenukha said, putting down the receiver, 'or maybe I should call...'	should
1846	DE	''Da meldet sich keiner'', sagte er und legte auf, ''ich muß es nachher noch mal versuchen ...''	müssen
1846	IT	- Non risponde, - disse, rimettendo il ricevitore sulla forcella, - proviamo a telefonare a...	lexical
1846	ES	—En su casa no contesta nadie —dijo colgando el teléfono—. ¿Qué hago?	missing
1846	FR	– Ça ne répond pas, dit Varienoukha en raccrochant. Si j’essayais encore le téléph…	lexical
1846	UK	— Не відповідає квартира, — сказав Варенуха, відкладаючи слухавку на важіль, — спробувати хіба що подзвонити ще…	infinitive
1860	RU	Варенуха проделал все, что полагается человеку в минуты великого изумления.	полагается
1860	EN	Varenukha did everything that a man in a moment of great astonishment ought to do.	ought to
1860	DE	Warenucha tat all das, was sich für einen sehr verwunderten Menschen zu tun geziemt.	infinitive
1860	IT	Varenucha fece quello che si usa fare nei momenti di grande sbalordimento.	infinitive
1860	ES	Varenuja se comportó como cualquier hombre se comporta ante algo insólito.	comportar
1860	FR	Quant à Varienoukha, il fit tout ce qu’est censé faire un homme au comble de l’étonnement.	infinitive
1860	UK	Варенуха вчинив усе, що належить людині в хвилини великого здивування.	належити
1868	RU	Ему ли не знать Степиного голоса!	conditional
1868	EN	Who if not he should know Styopa's voice?	should
1868	DE	Wie hätte Rimski Stjopas Stimme verkennen können!	conditional
1868	IT	Figuriamoci se lui, Rimskij, non conosceva la voce di Stepa!	conditional
1868	ES	Además, ¿quién, sino él, podía haberle hablado desde su casa por la mañana?	conditional
1868	FR	Il connaissait tout de même la voix de Stepan !	conditional
1868	UK	Чи ж йому не знати Стьопиного голосу!	conditional
1953	RU	Его собственные шуточки, – перебил экспансивный администратор и спросил: – А пакет-то везти?	infinitive
1953	EN	His own little jokes,' the expansive administrator interrupted, and asked: 'Shall I take the envelope?'	shall
1953	DE	Das sind alles seine Späße'', unterbrach ihn der Administrator unbeherrscht und fragte: ''Soll ich den Umschlag wegbringen?''	sollen
1953	IT	Sono scherzetti suoi! - lo interruppe l'espansivo amministratore, e chiese: - Devo portare il plico?	dovere
1953	ES	¡Cosas suyas! —interrumpió el impulsivo administrador, y preguntó—: ¿Llevo el paquete o no?	future
