ID	LANG	TEXT	CONSTR
635	RU	Но надо полагать , что все - таки рассказывал профессор , иначе придется допустить , что то же самое приснилось и Берлиозу , потому что тот сказал , внимательно всматриваясь в лицо иностранца :	надо
635	EN	But it must be supposed that the professor did tell the story after all , otherwise it would have to be assumed that Berlioz had had the same dream , because he said , studying the foreigner 's face attentively :	have to
635	DE	Der Professor mußte aber wohl doch erzählt haben , oder der Lyriker hätte annehmen müssen , Berlioz habe dasselbe geträumt , denn dieser blickte den Ausländer aufmerksam an und sagte : " Ihre Erzählung ist ungewöhnlich interessant , Professor , obwohl sie ganz und gar nicht mit dem Evangelium übereinstimmt . "	müssen
635	IT	Ma si deve supporre che fosse proprio stato il professore a raccontare, se no bisognerebbe ammettere che anche Berlioz aveva avuto lo stesso sogno. Questi disse infatti guardando con attenzione il volto dello straniero:	dovere
635	ES	Tenemos que suponer que realmente el profesor les había contado todo aquello, de otro modo habríamos de admitir que Berlioz había soñado lo mismo, porque, mirando fijamente al extranjero, dijo:	tener que
635	FR	Mais il faut croire que le professeur avait tout de même raconté quelque chose. Sinon, il faudrait admettre que Berlioz avait eu exactement le même rêve, car il dit, en dévisageant l’étranger avec attention :	il faut
635	UK	Та слід гадати, що усе ж таки розповідав професор, інакше доведеться припустити, що те саме наснилося й Берліозові, бо той сказав, уважно приглядаюсь до обличчя іноземця:	слід
666	RU	– Нету никакого дьявола ! – растерявшись от всей этой муры , вскричал Иван Николаевич не то , что нужно , – вот наказание !	нужно
666	EN	There is n't any devil ! ' Ivan Nikolaevich , at a loss from all this balderdash , cried out not what he ought . ' What a punishment !	ought
666	DE	 Wie soll es einen Teufel geben !  schrie Besdomny , der sich in dem ganzen Wirrwarr nicht mehr zurechtfand , und tat genau das , was er nicht sollte . " Das ist ja eine Strafe mit Ihnen !	sollen
666	IT	- Non c'è il diavolo! - esclamò Ivan Nikolaevi , confuso da tutto quel garbuglio. - Proprio a me doveva capitare?	missing
666	ES	—¡Claro que no! ¡No hay ningún diablo! —gritó de todos modos Iván Nikoláyevich, desconcertado con tanto lío—. ¡Pero qué castigo!	missing
666	FR	– Il n’y a pas de diable ! Ça n’existe pas ! s’écria, à contretemps, Ivan Nikolaïevitch, à qui toute cette compote faisait perdre la tête. C’est une punition, cet homme là !	missing
666	UK	— Немає ніякого диявола! — розгубившись від усієї цієї бредні, скрикнув Іван Миколайович не те, що треба. — От морока!	треба
672	RU	План Берлиоза следует признать правильным : нужно было добежать до ближайшего телефона - автомата и сообщить в бюро иностранцев о том , что вот , мол , приезжий из - за границы консультант сидит на Патриарших прудах в состоянии явно ненормальном . Так вот , необходимо принять меры , а то получается какая - то неприятная чепуха .	нужно
672	EN	Berlioz 's plan must be acknowledged as correct : he had to run to the nearest public telephone and inform the foreigners ' bureau , thus and so , there 's some consultant from abroad sitting at the Patriarch 's Ponds in an obviously abnormal state . So it was necessary to take measures , lest some unpleasant nonsense result .	have to
672	DE	Berlioz ' Plan darf als richtig gelten : Er mußte zur nächsten Telefonzelle laufen , das Ausländerbüro anrufen und melden , an den Patriarchenteichen sitze ein zugereister ausländischer Konsultant in offenkundig anomaler Verfassung . Es seien Maßnahmen zu ergreifen , sonst könne es zu einem Schlamassel kommen .	müssen
672	IT	Si deve ammettere che il piano di Berlioz era giusto: occorreva fare una corsa fino al piú vicino telefono pubblico e comunicare all'ufficio stranieri che un consulente arrivato dall'estero si trovava agli stagni Patriaršie in uno stato tutt'altro che normale. Bisognava perciò prendere delle misure, se no sarebbe successo un pasticcio.	occorrere
672	ES	Hay que reconocer que el plan de Berlioz era acertado: lo primero era encontrar un teléfono público y comunicar inmediatamente a la Sección de Extranjeros algo parecido a que el consejero recién llegado estaba en Los Estanques en un estado evidentemente anormal. Y habría que tomar las debidas precauciones, porque todo aquello era una cosa disparatada y bastante desagradable.	missing
672	FR	Il faut reconnaître que le plan de Berlioz était sage : courir à la cabine téléphonique la plus proche, et informer le bureau des étrangers que, voilà, il y avait ici, à l’étang du Patriarche, un étranger, qui se présentait comme un spécialiste appelé en consultation, et qui se trouvait dans un état manifestement anormal. Qu’il fallait donc prendre des mesures, sinon il en résulterait on ne sait quelle absurdité très désagréable.	missing
672	UK	Плян Берліоза слід визнати правильним: треба було добігти до найближчого телефону-автомата й сповістити бюро іноземців про те, що от, мовляв, приїжджий з-за кордону консультант сидить на Патріярших ставах у стані явно ненормальному. Так от, слід ужити заходів, бо виходить якась прикра нісенітниця.	треба
696	RU	Прямо , и выйдете куда надо .	надо
696	EN	Straight on and you 'll get where you 're going .	lexical
696	DE	Geradeaus , dann kommen Sie genau hin .	genau
696	IT	Vada diritto, e arriverà a destinazione.	future
696	ES	Siga derecho, que llegará donde va.	future
696	FR	Par ici, s’il vous plaît.	missing
696	UK	Просто, і вийдете, куди треба.	треба
792	RU	Но лишь кондукторша рванула веревку и трамвай тронулся , кот поступил как всякий , кого изгоняют из трамвая , но которому все - таки ехать - то надо . Пропустив мимо себя все три вагона , кот вскочил на заднюю дугу последнего , лапой вцепился в какую - то кишку , выходящую из стенки , и укатил , сэкономив , таким образом , гривенник .	надо
792	EN	But as soon as the conductress yanked the cord and the tram - car started moving off , the cat acted like anyone who has been expelled from a tram - car but still needs a ride . Letting all three cars go by , the cat jumped on to the rear coupling - pin of the last one , wrapped its paws around some hose sticking out of the side , and rode off , thus saving himself ten kopecks .	need
792	DE	Kaum aber hatte die Schaffnerin die Leine gezogen und die Straßenbahn sich in Bewegung gesetzt , da tat der Kater das , was jeder tut , der aus der Straßenbahn gejagt wird und doch mitfahren muß . Er ließ die beiden Anhänger an sich vorbeirollen , sprang hinten auf , krallte sich mit der Pfote an einen Schlauch fest , der aus der Rückwand kam , und fuhr , den Zehner sparend , davon .	müssen
792	IT	Ma non appena la bigliettaia diede il segnale e il tram si mosse, il gatto si comportò come chiunque sia cacciato da un tram, sul quale deve viaggiare per forza. Dopo essersi lasciato passare davanti tutte e tre le vetture, balzò sulla parte posteriore dell'ultima, si afferrò con la zampa a un tubo che usciva dal veicolo e filò via, economizzando in tal modo il prezzo della corsa.	dovere
792	ES	Pero cuando la cobradora tiró de la cuerda y el tranvía se puso en marcha, el gato hizo lo mismo que hubiera hecho cualquiera en el caso de haber sido expulsado de un tranvía y que tiene necesariamente que viajar en él. Dejó pasar los tres vagones del tranvía, saltó al borde del último, se aferró con una pata a una de las gomas que colgaban de la trasera y así pudo hacer su viaje, ahorrándose además diez kopeks.	necesariamente
792	FR	Mais dès que la receveuse eut tiré le cordon de la sonnette et que le tramway se fut ébranlé, le chat agit comme toute personne qui se voit chassée d’un tramway qu’il a, pour une raison ou une autre, absolument besoin de prendre. Il laissa défiler devant lui les trois wagons, puis sauta à l’arrière du dernier, s’accrocha d’une patte à une espèce de gros tuyau qui sortait de la paroi, et… roulez. Il économisait ainsi dix kopecks.	besoin
792	UK	Та лиш кондукторка рвонула мотузку й трамвай рушив, кіт вчинив як усякий, кого виганяють із трамваю, але кому їхати все ж треба. Пропустивши повз себе усі три вагони, кіт скочив на задню дугу останнього, вчепився за якусь кишку, що виходила із стінки, і покотив, заощадивши таким робом гривеника.	треба
807	RU	Однако повезло не так уж , как бы нужно было !	нужно
807	EN	However , his luck was not all it might have been !	might
807	DE	Jedoch sein Glück war nicht so groß , wie es wünschenswert gewesen wäre .	wünschenswert
807	IT	Però non tanta quanta occorreva!	occorrere
807	ES	Pero no tuvo tanta como hubiera deseado.	tener que
807	FR	Cette chance, cependant, n’était pas celle qu’il aurait fallu !	il avait
807	UK	Та пощастило не так, як би треба було!	треба
873	RU	Это чувство дрянной категории , но все же надо войти и в положение посетителя .	надо
873	EN	This feeling belongs to the nasty category , but all the same one must put oneself in the visitor 's position .	must
873	DE	Er ist ein miserables Gefühl . Aber man muß sich in die Lage des Besuchers versetzen .	müssen
873	IT	È un sentimento catalogabile fra i piú abietti, ma bisogna mettersi nei panni del visitatore.	bisognare
873	ES	Es un sentimiento de ínfima categoría, pero hay que comprender al visitante.	haber que
873	FR	L’envie est un sentiment vil, certes, mais il faut tout de même se mettre à la place du visiteur.	il faut
873	UK	Це почуття плюгавої категорії, але усе ж треба зглянутися на становище відвідувача.	треба
927	RU	– Не надо , товарищи , завидовать .	надо
927	EN	We must n't be envious , comrades .	have to
927	DE	 Genossen , man muß nicht neidisch sein .   	müssen
927	IT	- Non bisogna essere invidiosi, compagni.	bisognare
927	ES	—No hay que ser envidiosos, camaradas.	haber
927	FR	– Il ne faut pas être jaloux, camarades. 	il faut
927	UK	— Не треба, товариші, заздрити.	треба
1040	RU	– Ты , – оскалившись , перебил Иван , – понимаешь ли , что надо поймать профессора ?  	надо
1040	EN	 You , ' Ivan interrupted , baring his teeth , but do n't you understand that the professor has to be caught ?	have to
1040	DE	 Du  , unterbrach ihn Iwan zähnefletschend , " kapierst du nicht , daß man den Professor fangen muß ?	müssen
1040	IT	- Tu, - lo interruppe Ivan digrignando i denti, - lo capisci che bisogna prendere il professore?	bisognare
1040	ES	—Pero ¿no te das cuenta que hace falta atrapar al profesor?	haber que
1040	FR	– Tu ne comprends pas, coupa Ivan en montrant les dents, qu’il faut attraper le professeur ?	il faut
1040	UK	— Ти, — вишкірившись, перебив Іван, — чи розумієш, що треба зловити професора?	треба
1068	RU	Нам таких швейцаров в ресторане и даром не надо .	надо
1068	EN	We have no need of such doormen in the restaurant .	need to
1068	DE	Solche Portiers können wir im Restaurant nicht gebrauchen .	brauchen
1068	IT	Di portieri cosí, al ristorante, non li vogliamo neanche gratis!	volere
1068	ES	Ni regalados nos interesan conserjes como tú.	interesar
1068	FR	Tu n’es bon qu’à faire un bedeau !	faire
1068	UK	Нам таких швайцарів у ресторані й задурно не треба.	треба
1142	RU	– Да при чем здесь « толкнул » ? – сердясь на общую бестолковость , воскликнул Иван , – такому и толкать не надо !	надо
1142	EN	 " Pushed him " , nothing ! ' Ivan exclaimed , angered by the general obtuseness . ' His kind do n't need to push !	need to
1142	DE	 Wieso denn gestoßen ?  rief Iwan , ungehalten über die allgemeine Begriffsstutzigkeit . " So was hat der gar nicht nötig !	nötig
1142	IT	- Che c'entra la «spinta»? - esclamò Ivan, infuriandosi per la stupidità generale. - Uno come lui non ha bisogno di spingere!	bisogno
1142	ES	—Pero ¿por qué «empujó»? —exclamó Iván irritado por la torpeza general—. Ese no tiene ni que molestarse en empujar.	tener que
1142	FR	– Qui vous parle de « pousser » ? s’écria Ivan, irrité par cette sottise générale. Est-ce que vous vous figurez qu’il a besoin de pousser, lui ?	besoin
1142	UK	— Та яке там «штовхнув»? — озлоблений загальною нетямою, викрикнув Іван. — Такому й штовхати не треба!	треба
1202	RU	Шизофрения , надо полагать . А тут еще алкоголизм ...	надо
1202	EN	Schizophrenia , I suppose . Plus this alcoholism ... '	lexical
1202	DE	Ich nehme an , Schizophrenie . Alkoholismus kommt dazu ... "	lexical
1202	IT	Schizofrenia, immagino. E per di piú l'etilismo...	lexical
1202	ES	Tenemos que suponer que sea esquizofrenia y además alcoholismo...	tener
1202	FR	Schizophrénie, vraisemblablement. Et par làdessus, l’alcoolisme…	lexical
1202	UK	Шизофренія, слід гадати. А тут ще й алькоголізм…	слід
1315	RU	Степа был хитрым человеком и , как ни был болен , сообразил , что раз уж его застали в таком виде , нужно признаваться во всем .	нужно
1315	EN	Styopa was a shrewd man and , sick as he was , realized that since he had been found in this state , he would have to confess everything .	have to
1315	DE	Der gewitzte Stjopa , so angeschlagen er war , wußte doch , daß er , war er schon in solchem Zustand angetroffen worden , alles zugeben mußte .	müssen
1315	IT	Stepa era un uomo furbo e, per quanto stesse male, capí che, dal momento che l'avevano trovato in quello stato, doveva confessare tutto.	dovere
1315	ES	Stiopa, que era un hombre astuto, comprendió, a pesar de su situación, que ya que le había encontrado en tal estado, tenía que confesarlo todo.	tener que
1315	FR	Stepan était un homme astucieux et, quoique malade, il se rendait bien compte que, puisqu’on l’avait trouvé dans cet état, mieux valait tout avouer.	mieux
1315	UK	Стьопа був хитрою людиною і, хоч би як недужим він був, зміркував, що як його вже прихопили в такому стані, слід визнавати усе.	слід
1440	RU	В самом деле , засадили здорового человека в лечебницу , да еще делают вид , что это так и нужно !	нужно
1440	EN	Indeed , they lock up a healthy man in a clinic , and pretend that that is how it ought to be !	ought to
1440	DE	Wirklich , man sperrte einen gesunden Menschen in die Klapsmühle und tat auch noch , als müsse das so sein !	müssen
1440	IT	Infatti, avevano rinchiuso un uomo sano in un ospedale, e facevano anche finta che si trattasse di una cosa normalissima!	missing
1440	ES	¡De modo que después de meter en una clínica mental a un hombre cuerdo, hacen como si no hubiera pasado nada!	missing
1440	FR	Car enfin, on bouclait dans une maison de santé un homme parfaitement sain d’esprit, et, en plus, on faisait semblant de trouver cela normal !	missing
1440	UK	Справді бо: засадили здорову людину до лікарні, та ще й удають, ніби так воно й треба!	треба
1508	RU	– Мне с вами нужно поговорить , – многозначительно сказал Иван Николаевич .	нужно
1508	EN	 I must speak with you , ' Ivan Nikolaevich said meaningly .	must
1508	DE	 Ich muß mit Ihnen sprechen  , sagte Iwan bedeutungsvoll .	müssen
1508	IT	- Ho bisogno di parlarle, - disse in modo significativo Ivan Nikolaevi .	bisogno
1508	ES	—Necesito hablar con usted —dijo Iván Nikoláyevich con aire significativo.	necesito
1508	FR	– J’ai à vous parler, dit Ivan Nikolaïevitch d’un air significatif.	j’ai à
1508	UK	— Мені з вами треба говорити, — багатозначно сказав Іван Миколайович.	треба
1536	RU	Его надо немедленно арестовать , иначе он натворит неописуемых бед .	надо
1536	EN	He must be arrested immediately , otherwise he 'll do untold harm . '	must
1536	DE	Man muß ihn sofort festnehmen , sonst richtet er unbeschreibliches Unheil an . "	müssen
1536	IT	Bisogna arrestarlo subito, se no combinerà guai indescrivibili.	bisognare
1536	ES	Hay que detenerle rápidamente, o hará un daño irreparable.	tener que
1536	FR	Il faut immédiatement le faire arrêter, sinon il causera des malheurs indescriptibles.	il faut
1536	UK	Його треба негайно заарештувати, бо він накоїть небаченого лиха.	треба
1538	RU	« Он умен , – подумал Иван , – надо признаться , что среди интеллигентов тоже попадаются на редкость умные . Этого отрицать нельзя ! » – и ответил :	надо
1538	EN	 He 's intelligent , ' thought Ivan . " You 've got to admit , even among intellectuals you come across some of rare intelligence , there 's no denying it , ' and he replied :	lexical
1538	DE	Er ist klug , dachte Iwan , man muß zugeben , daß es unter den Intelligenzlern gelegentlich auch sehr kluge Köpfe gibt . Unbestreitbar .	müssen
1538	IT	«È intelligente, - pensò Ivan, - bisogna ammettere che anche tra gli intellettuali si trovano persone d'intelligenza non comune, non lo si può negare», e rispose:	bisognare
1538	ES	No hay duda. Y contestó:	missing
1538	FR	« Il est intelligent, pensa Ivan. Il faut reconnaître que, parmi les intellectuels, on rencontre parfois, à titre exceptionnel, des gens intelligents. On ne peut le nier. » Et il répondit :	il faut
1538	UK	«Він розумний, — подумав Іван, — слід визнати, що серед інтеліґентів теж трапляються напрочуд розумні. Цього заперечувати не можна!» — й відповів:	слід
1595	RU	И вам непременно нужно остаться здесь .	нужно
1595	EN	And you absolutely must remain here . '	must
1595	DE	Sie müssen unbedingt hierbleiben . "	müssen
1595	IT	Lei deve assolutamente restare qui.	dovere
1595	ES	Lo que tiene que hacer, por tanto, es quedarse aquí.	tener que
1595	FR	Et il est indispensable que vous restiez ici.	être que
1595	UK	І вам неодмінно слід залишитися тут.	слід
1602	RU	Не всему надо верить .	надо
1602	EN	One must n't believe everything . '	must
1602	DE	Man darf nicht alles glauben . "	dürfen
1602	IT	Non bisogna credere a tutto.	bisognare
1602	ES	—¡Comprendido! —exclamó Iván en un arranque de decisión—.	missing
1602	FR	Vous savez, si on croyait tout ce que les gens racontent…	syntax
1602	UK	Та не всьому слід вірити.	слід
1691	RU	К осени надо было закупать нефть для парового отопления , а на какие шиши – неизвестно .	надо
1691	EN	Fuel had to be bought for the heating system by fall , but who was going to shell out for it - no one knew .	have to
1691	DE	Im Herbst mußte Öl für die Dampfheizung gekauft werden , doch wovon , wußte keiner .	müssen
1691	IT	In autunno sarebbe stato necessario comprare la nafta per il riscaldamento, ma con quali quattrini non si sapeva.	necessario
1691	ES	Cuando llegara el otoño tenían que comprar petróleo para la calefacción, pero nadie sabía de dónde podrían sacar el dinero necesario.	tener que
1691	FR	À l’automne, il faudrait acheter du mazout pour le chauffage, mais avec quels sous – mystère.	il faut
1691	UK	До осені треба було закупляти нафту до парового опалення, а на яке купило — хтозна.	треба
1763	RU	– Это бывает , – согласился тот , первый , и опять - таки мягко добавил : – Ну что же , надо остальные сдавать .	надо
1763	EN	 That happens , ' the first agreed and added , again gently : ' Well , you 're going to have to turn in the rest . '	have to
1763	DE	 So etwas kommt vor  , stimmte der eine zu und fuhr sanft fort : " Sie müssen aber auch das übrige abgeben . "	müssen
1763	IT	- Capita, - acconsentí il primo, e aggiunse con la stessa dolcezza: - Be', bisogna consegnare gli altri.	bisognare
1763	ES	¡Lo han puesto aquí enemigos!	haber
1763	FR	– Ça se peut, dit le premier, qui ajouta, toujours avec douceur : Bon, maintenant, il faut nous donner le reste.	il faut
1763	UK	— Таке буває, — погодився той, перший, і знову ж таки м’яко додав: — Ну що ж, треба решту здавати.	треба
2229	RU	Да , кстати , в это ли время или немножко раньше , но только маг , вместе со своим полинялым креслом , исчез со сцены , причем надо сказать , что публика совершенно этого не заметила , увлеченная теми чрезвычайными вещами , которые развернул на сцене Фагот . А Фагот , спровадив пострадавшего конферансье , объявил публике так : – Таперича , когда этого надоедалу сплавили , давайте откроем дамский магазин !	надо
2229	EN	Ah , yes , incidentally , either then or a little earlier , the magician disappeared from the stage together with his faded armchair , and it must be said that the public took absolutely no notice of it , carried away as it was by the extraordinary things Fagott was unfolding on stage . And Fagott , having packed off the punished master of ceremonies , addressed the public thus : ` All righty , now that we 've kicked that nuisance out , let 's open a ladies ' shop ! '	must
2229	DE	Übrigens war zu diesem Zeitpunkt oder etwas früher der Magier mitsamt seinem verschossenen SesSel von der Bühne verschwunden , wobei erwähnt sei , daß das Publikum dies überhaupt nicht bemerkte , da es von den ungewöhnlichen Kunststücken Fagotts auf der Bühne gefesselt war . Nachdem Fagott nämlich den arg mitgenommenen Conferencier von der Bühne gejagt hatte , erklärte er dem Publikum : , Jetzt , nachdem wir diesen Widerling abgeschoben haben , wollen wir ein Damenatelier eröffnen ! "	sei
2229	IT	A proposito, forse in quel momento, o forse un po' prima, il mago era scomparso dalla scena con la sua poltrona sbiadita, e bisogna dire che il pubblico non se n'era affatto accorto, trascinato dalle cose straordinarie che andava facendo sul palcoscenico Fagotto. Questi, dopo aver accompagnato fuori il presentatore sinistrato, dichiarò al pubblico: - Adesso che ci siamo sbarazzati di quel rompiscatole, apriamo un negozio di articoli per signora.	bisognare
2229	ES	En aquel momento, o algo antes, el mago había desaparecido del escenario junto con su descolorido sillón, y aquello había pasado inadvertido para el público, absorto en los sorprendentes acontecimientos que se desarrollaban en escena gracias a Fagot, que, después de librarse del malsano presentador, se dirigió al público: —Bueno, ahora que nos acabamos de quitar a ese plomo de encima, vamos a abrir una tienda para señoras.	haber que
