ID	LANG	TEXT	CONSTR
33	RU	Очертил Бездомный главное действующее лицо своей поэмы , то есть Иисуса , очень черными красками , и тем не менее всю поэму приходилось , по мнению редактора , писать заново .	приходиться
33	EN	Homeless had portrayed the main character of his poem - that is , Jesus - in very dark colours , but nevertheless the whole poem , in the editor 's opinion , had to be written over again .	have to
33	DE	Der Lyriker hatte die Hauptperson , Jesus also , in sehr schwarzen Farben gemalt , doch nichtsdestoweniger mußte nach Meinung des Redakteurs das Poem völlig neu geschrieben werden .	müssen
33	IT	Bezdomnyj aveva tratteggiato il personaggio principale del suo poema, cioè Gesú, a tinte molto fosche, eppure tutto il poema, secondo il direttore, andava rifatto di sana pianta.	andare
33	ES	Desamparado describía al personaje central de su poema —es decir, a Cristo— con tonos muy negros. Berlioz consideraba que tenía que hacer un poema nuevo.	tener que
33	FR	Biezdomny avait peint son personnage principal – Jésus-Christ – sous les couleurs les plus sombres, et pourtant, de l’avis du rédacteur en chef, tout le poème était à refaire.	être à
33	UK	Окреслив Бездомний чільну дійову особу своєї поеми, тобто Ісуса, дуже чорними барвами, а проте усю поему доводилося, на думку редактора, писати наново.	доведеться
168	RU	Так что вы уж сами узнайте это у него , Иван Николаевич !	imperative
168	EN	So you will have to find that out from him yourself , Ivan Nikolaevich ! '	have to
168	DE	Das müssen Sie ihn schon selber fragen , Iwan Nikolajewitsch ! "	müssen
168	IT	Si informi lei stesso, Ivan Nikolaevi !	imperative
168	ES	Por favor, pregúnteselo usted mismo, Iván Nikoláyevich.	imperative
168	FR	C’est donc vous-même qui le lui demanderez, Ivan Nikolaïevitch !	imperative
168	UK	То ви вже самі довідайтесь про це в нього, Іване Миколайовичу!	imperative
185	RU	« Черт , все слышал , » – подумал Берлиоз и вежливым жестом показал , что в предъявлении документов нет надобности .	нет надобности
185	EN	 The devil , he heard everything ... ' Berlioz thought , and with a polite gesture indicated that there was no need to show papers .	need to
185	DE	Zum Teufel , er hat alles gehört , dachte Berlioz und deutete mit weltmännischer Geste an , daß die Vorlage der Papiere überflüssig sei .	sei
185	IT	«Diavolo, ha sentito tutto», pensò Berlioz e fece un gesto cortese come a dire che non era il caso di mostrare i documenti.	essere il caso
185	ES	¡Diablos!, nos ha oído, pensó Berlioz, indicándole con un ademán que los documentos no eran necesarios.	necesario
185	FR	L’inconnu souligna ces paroles significatives d’un regard pénétrant, qui remplit de confusion les deux hommes de lettres.	missing
185	UK	«От чорт, чув усе…» — подумав Берліоз і чемним жестом показав, що в вказуванні документів немає потреби.	мати потреби
304	RU	Он смотрел мутными глазами на арестованного и некоторое время молчал , мучительно вспоминая , зачем на утреннем безжалостном Ершалаимском солнцепеке стоит перед ним арестант с обезображенным побоями лицом , и какие еще никому не нужные вопросы ему придется задавать .	приходиться
304	EN	He gazed with dull eyes at the arrested man and was silent for a time , painfully trying to remember why there stood before him in the pitiless morning sunlight of Yershalaim this prisoner with his face disfigured by beating , and what other utterly unnecessary questions he had to ask him .	have to
304	DE	Mit trüben Augen blickte er den Gefangenen an und schwieg einige Zeit . Qualvoll überlegte er , warum der Mann mit dem von Schlägen verunstalteten Gesicht in der erbarmungslosen morgendlichen Jerschalaimer Sonnenglut vor ihm stand und was für überflüssige Fragen er ihm noch stellen sollte .	sollen
304	IT	Guardava l'arrestato con occhi torbidi, e per un po' tacque, cercando penosamente di ricordare perché sotto lo spietato solleone mattutino di Jerushalajim stava davanti a lui un arrestato dal volto tumefatto dalle percosse, e quali altre domande inutili dovesse ancora rivolgergli.	dovere
304	ES	Miraba con ojos turbios al detenido y permanecía callado; le costaba trabajo recordar por qué estaba delante de él, bajo el implacable sol de Jershalaím, un hombre con la cara desfigurada por los golpes, y qué inútiles preguntas tendría que hacerle todavía.	tener que
304	FR	Ses yeux troubles revinrent au prisonnier et il demeura un moment silencieux, essayant douloureusement de se rappeler pourquoi, sous l’impitoyable soleil matinal de Jérusalem, on lui avait amené ce prévenu au visage marqué de coups, et quelles questions – qui n’intéresseraient jamais personne d’ailleurs – il fallait encore lui poser.	il faut
304	UK	Він дивився каламутними очима на арештованого і якусь хвилю мовчав, болісно згадуючи, навіщо це на ранковому безжалісному єршалаїмському осонні стоїть перед ним арештант із понівеченим побоями лицем, і які ще нікому не потрібні питання йому доведеться ставити.	доведеться
334	RU	Приходилось верить .	приходиться
334	EN	He had to believe .	have to
334	DE	Aber er mußte es wohl .	müssen
334	IT	Bisognava crederci.	bisognare
334	ES	Pero parecía ser cierto.	missing
334	FR	Il le fallait bien.	il faut
334	UK	Доводилося вірити.	доведеться
413	RU	– Мне не нужно знать , – придушенным , злым голосом отозвался Пилат , – приятно или неприятно тебе говорить правду .	нужно
413	EN	` I have no need to know , ' Pilate responded in a stifled , angry voice , ' whether it is pleasant or unpleasant for you to speak the truth .	need to
413	DE	 Ich will nicht wissen  , erwiderte Pilatus dumpf und gereizt , " ob es dir angenehm oder unangenehm ist , die Wahrheit zu sagen .	wollen
413	IT	- Non m'interessa, - ribatté con voce strozzata e cattiva Pilato, - se ti è grato o no dire la verità.	lexical
413	ES	—No quiero saber —contestó Pilatos con una voz ahogada y dura— si te resulta agradable o no decir la verdad.	querer + inf
413	FR	Pilate faillit s’étrangler de fureur : – Je me moque de savoir s’il t’est agréable ou non de dire la vérité !	missing
413	UK	— Мені не треба знати, — здушеним, злим голосом озвався Пилат, — приємно чи неприємно тобі казати правду.	треба
414	RU	Но тебе придется ее говорить .	приходиться
414	EN	You will have to speak it anyway .	have to
414	DE	Du mußt sie ohnehin sagen .	müssen
414	IT	Ma tu la dovrai dire.	dovere
414	ES	Tendrás que decirla.	tener que
414	FR	Il faudra bien que tu la dises, de toute façon.	il faut
414	UK	Та тобі доведеться її казати.	доведеться
491	RU	Согласно закону , согласно обычаю , одного из этих двух преступников нужно будет отпустить на свободу в честь наступающего сегодня великого праздника пасхи .	нужно
491	EN	According to the law , according to custom , one of these two criminals had to be released in honour of the great feast of Passover , which would begin that day .	have to
491	DE	Nach Gesetz und Sitte müsse einer dieser beiden Verbrecher zu Ehren des bevorstehenden Pessachfestes freigelassen werden .	müsse
491	IT	Secondo la legge e la consuetudine, si sarebbe dovuto rilasciare uno dei due prigionieri in onore della grande festa della Pasqua che stava per iniziare.	dovere
491	ES	De acuerdo con la ley y de acuerdo con la costumbre, uno de estos dos delincuentes tenía que ser liberado en honor a la gran fiesta de Pascua que empezaba aquel día.	tener que
491	FR	Selon la Loi et selon la coutume, l’un de ces deux criminels devait être remis en liberté, en l’honneur de la grande fête de pâque qui commençait aujourd’hui.	devoir
491	UK	Згідно з законом, згідно зі звичаєм одного з цих двох злочинців слід буде відпустити на волю на честь великого свята Пасхи, що настає сьогодні.	слід
547	RU	– О нет ! – воскликнул Пилат , и с каждым словом ему становилось все легче и легче : не нужно было больше притворяться . Не нужно было подбирать слова . – Слишком много ты жаловался кесарю на меня , и настал теперь мой час , Каифа !	нужно
547	EN	 Oh , no ! ' Pilate exclaimed , and he felt lighter and lighter with every word : there was no more need to pretend , no more need to choose his words , ` you have complained about me too much to Caesar , and now my hour has come , Kaifa !	need to
547	DE	 O nein !  rief Pilatus aus , und mit jedem Wort wurde ihm leichter , denn jetzt brauchte er nicht mehr sich zu verstellen , nicht mehr die Worte zu wählen . " Gar zu oft hast du dich beim Kaiser über mich beklagt , Kaiphas , doch jetzt ist meine Stunde gekommen !	brauchen
547	IT	- Oh no! - esclamò Pilato, e a ogni parola si sentiva meglio: non occorreva piú fingere, non occorreva pesare le parole. - Ti sei troppo lamentato di me con Cesare, e adesso è giunta la mia ora, Caifa!	occorrere
547	ES	—¡Oh, no! —exclamó Pilatos, y cada palabra le hacía sentirse más aliviado: ya no tenía que fingir, no tenía que medir las palabras—. ¡Te has quejado al César de mí demasiadas veces, Caifás, y ha llegado mi hora!	tener que
547	FR	– Oh ! non ! s’écria Pilate, et chaque mot qu’il prononçait lui apportait un nouveau soulagement : plus besoin de simuler, plus besoin de choisir ses termes. Trop longtemps tu t’es plaint de moi à César, maintenant mon heure est venue. Caïphe !	besoin
547	UK	— О ні! — вигукнув Пилат, і що не слово йому ставало дедалі легше й легше: не треба було більше прикидатися, не треба було добирати слів. — Надто багато ти скаржився кесареві на мене, і настав тепер мій час, Каїфо!	треба
549	RU	Вспомни , как мне пришлось из - за вас снимать со стен щиты с вензелями императора , перемещать войска , пришлось , видишь , самому приехать , глядеть , что у вас тут творится !	приходиться
549	EN	Remember how on account of you I had to remove the shields with the emperor 's insignia from the walls , had to transfer troops , had , as you see , to come in person to look into what goes on with you here !	have to
549	DE	Vergiß nicht , daß ich euretwegen die Schilde mit dem kaiserlichen Emblem von der Wand nehmen , Truppen verlegen und selber herkommen mußte , um hier bei euch nach dem Rechten zu sehen !	müssen
549	IT	Ricordati come io dovetti per causa vostra togliere dalle mura gli scudi con l'emblema dell'imperatore, spostare le truppe.	dovere
549	ES	¡Acuérdate de cómo por vuestra culpa tuve que arrancar de las paredes los escudos con la efigie del emperador, trasladar a los soldados, cómo tuve que venir aquí para ver qué ocurría!	missing
549	FR	Rappelle-toi que j’ai dû, à cause de vous, faire enlever des murs les écussons au chiffre de l’empereur, déplacer des troupes, et venir moi-même ici, figure-toi, pour voir ce que vous fabriquiez !	missing
549	UK	Згадай, як довелося мені через вас знімати з мурів щити з вензелями імператора, переміщувати війська, довелось, бачиш, самому приїхати подивитись, що в вас тут діється!	доведеться
635	RU	Но надо полагать , что все - таки рассказывал профессор , иначе придется допустить , что то же самое приснилось и Берлиозу , потому что тот сказал , внимательно всматриваясь в лицо иностранца :	надо
635	EN	But it must be supposed that the professor did tell the story after all , otherwise it would have to be assumed that Berlioz had had the same dream , because he said , studying the foreigner 's face attentively :	must
635	DE	Der Professor mußte aber wohl doch erzählt haben , oder der Lyriker hätte annehmen müssen , Berlioz habe dasselbe geträumt , denn dieser blickte den Ausländer aufmerksam an und sagte : " Ihre Erzählung ist ungewöhnlich interessant , Professor , obwohl sie ganz und gar nicht mit dem Evangelium übereinstimmt . "	müssen
635	IT	Ma si deve supporre che fosse proprio stato il professore a raccontare, se no bisognerebbe ammettere che anche Berlioz aveva avuto lo stesso sogno. Questi disse infatti guardando con attenzione il volto dello straniero:	dovere
635	ES	Tenemos que suponer que realmente el profesor les había contado todo aquello, de otro modo habríamos de admitir que Berlioz había soñado lo mismo, porque, mirando fijamente al extranjero, dijo:	tener que
635	FR	Mais il faut croire que le professeur avait tout de même raconté quelque chose. Sinon, il faudrait admettre que Berlioz avait eu exactement le même rêve, car il dit, en dévisageant l’étranger avec attention :	il faut
635	UK	Та слід гадати, що усе ж таки розповідав професор, інакше доведеться припустити, що те саме наснилося й Берліозові, бо той сказав, уважно приглядаюсь до обличчя іноземця:	слід
635-2	RU	Но надо полагать , что все - таки рассказывал профессор , иначе придется допустить , что то же самое приснилось и Берлиозу , потому что тот сказал , внимательно всматриваясь в лицо иностранца :	приходиться
635-2	EN	But it must be supposed that the professor did tell the story after all , otherwise it would have to be assumed that Berlioz had had the same dream , because he said , studying the foreigner 's face attentively :	would have to
635-2	DE	Der Professor mußte aber wohl doch erzählt haben , oder der Lyriker hätte annehmen müssen , Berlioz habe dasselbe geträumt , denn dieser blickte den Ausländer aufmerksam an und sagte : " Ihre Erzählung ist ungewöhnlich interessant , Professor , obwohl sie ganz und gar nicht mit dem Evangelium übereinstimmt . "	müssen
635-2	IT	Ma si deve supporre che fosse proprio stato il professore a raccontare, se no bisognerebbe ammettere che anche Berlioz aveva avuto lo stesso sogno. Questi disse infatti guardando con attenzione il volto dello straniero:	bisognare
635-2	ES	Tenemos que suponer que realmente el profesor les había contado todo aquello, de otro modo habríamos de admitir que Berlioz había soñado lo mismo, porque, mirando fijamente al extranjero, dijo:	haber
635-2	FR	Mais il faut croire que le professeur avait tout de même raconté quelque chose. Sinon, il faudrait admettre que Berlioz avait eu exactement le même rêve, car il dit, en dévisageant l’étranger avec attention :	il faut
635-2	UK	Та слід гадати, що усе ж таки розповідав професор, інакше доведеться припустити, що те саме наснилося й Берліозові, бо той сказав, уважно приглядаюсь до обличчя іноземця:	доведеться
650	RU	Берлиоз тотчас сообразил , что следует делать .	следует
650	EN	Berlioz realized at once what had to be done .	have to
650	DE	Berlioz erwog sofort , was zu tun sei .	sei
650	IT	Berlioz capí subito quello che conveniva fare.	convenire
650	ES	Berlioz reaccionó enseguida y decidió lo que había que hacer.	haber que
650	FR	Berlioz sut tout de suite ce qu’il allait faire.	aller
650	UK	Берліоз одразу зміркував, що треба робити.	треба
672	RU	План Берлиоза следует признать правильным : нужно было добежать до ближайшего телефона - автомата и сообщить в бюро иностранцев о том , что вот , мол , приезжий из - за границы консультант сидит на Патриарших прудах в состоянии явно ненормальном . Так вот , необходимо принять меры , а то получается какая - то неприятная чепуха .	нужно
672	EN	Berlioz 's plan must be acknowledged as correct : he had to run to the nearest public telephone and inform the foreigners ' bureau , thus and so , there 's some consultant from abroad sitting at the Patriarch 's Ponds in an obviously abnormal state . So it was necessary to take measures , lest some unpleasant nonsense result .	have to
672	DE	Berlioz ' Plan darf als richtig gelten : Er mußte zur nächsten Telefonzelle laufen , das Ausländerbüro anrufen und melden , an den Patriarchenteichen sitze ein zugereister ausländischer Konsultant in offenkundig anomaler Verfassung . Es seien Maßnahmen zu ergreifen , sonst könne es zu einem Schlamassel kommen .	müssen
672	IT	Si deve ammettere che il piano di Berlioz era giusto: occorreva fare una corsa fino al piú vicino telefono pubblico e comunicare all'ufficio stranieri che un consulente arrivato dall'estero si trovava agli stagni Patriaršie in uno stato tutt'altro che normale. Bisognava perciò prendere delle misure, se no sarebbe successo un pasticcio.	dovere
672	ES	Hay que reconocer que el plan de Berlioz era acertado: lo primero era encontrar un teléfono público y comunicar inmediatamente a la Sección de Extranjeros algo parecido a que el consejero recién llegado estaba en Los Estanques en un estado evidentemente anormal. Y habría que tomar las debidas precauciones, porque todo aquello era una cosa disparatada y bastante desagradable.	haber que
672	FR	Il faut reconnaître que le plan de Berlioz était sage : courir à la cabine téléphonique la plus proche, et informer le bureau des étrangers que, voilà, il y avait ici, à l’étang du Patriarche, un étranger, qui se présentait comme un spécialiste appelé en consultation, et qui se trouvait dans un état manifestement anormal. Qu’il fallait donc prendre des mesures, sinon il en résulterait on ne sait quelle absurdité très désagréable.	il faut
672	UK	Плян Берліоза слід визнати правильним: треба було добігти до найближчого телефону-автомата й сповістити бюро іноземців про те, що от, мовляв, приїжджий з-за кордону консультант сидить на Патріярших ставах у стані явно ненормальному. Так от, слід ужити заходів, бо виходить якась прикра нісенітниця.	слід
801	RU	Ждать пришлось недолго : открыла Ивану дверь какая - то девочка лет пяти и , ни о чем не справляясь у пришедшего , немедленно ушла куда - то .	приходиться
801	EN	He did not have to wait long . Some little girl of about five opened the door for Ivan and , without asking him anything , immediately went away somewhere .	have to
801	DE	Er brauchte nicht lange zu warten . Ein kleines Mädchen von vielleicht fünf Jahren öffnete ihm und entfernte sich sofort , ohne ihm Fragen zu stellen .	brauchen
801	IT	Non dovette aspettare a lungo. La porta gli fu aperta da una bimbetta sui cinque anni che se ne andò via subito senza chiedergli niente.	dovere
801	ES	No le hicieron esperar mucho. Una niña de unos cinco años abrió la puerta y, sin preguntar nada, desapareció en el interior.	hacer
801	FR	Il n’eut pas à attendre longtemps. La porte lui fut ouverte par une petite fille inconnue, âgée de cinq ans environ, qui, sans lui poser la moindre question, s’enfuit aussitôt on ne sait où.	il n’eut pas
801	UK	Чекати довелось недовго: двері Іванові відчинила якась дівчинка років п’яти і, нічого не питаючи в зайди, відразу пішла собі десь.	доведеться
949	RU	Тут опять про себя недобрым словом помянули Михаила Александровича : все столики на веранде , натурально , оказались уже занятыми , и пришлось оставаться ужинать в этих красивых , но душных залах .	приходиться
949	EN	Here again they silently berated Mikhail Alexandrovich : all the tables on the veranda , naturally , were occupied , and they had to stay for supper in those beautiful but airless halls .	have to
949	DE	Hier schmähten sie Berlioz im stillen abermals mit bösen Worten , denn auf der Veranda waren natürlich alle Tische besetzt , und sie mußten in den schönen , doch stickigen Sälen zu Abend essen .	müssen
949	IT	Anche qui imprecarono sottovoce contro Michail Aleksandrovi : i tavolini sulla veranda, naturalmente, erano già occupati, ed essi furono costretti a cenare nelle belle ma afose sale interne.	costretto
949	ES	Allí hablaron de nuevo de Mijaíl Alexándrovich y con palabras poco amables. Todas las mesas de fuera estaban ocupadas, como era lógico, y tuvieron que quedarse a cenar en los preciosos pero bochornosos salones.	tener que
949	FR	Là encore, chacun murmura à part soi quelques mots malsonnants à l’adresse de Mikhaïl Alexandrovitch : car naturellement, toutes les tables de dehors étaient occupées, et force était d’aller dîner dans ces salles magnifiques, certes, mais étouffantes.	force était d’aller
949	UK	Тут знову подумки недобрим словом пом’янули Михайла Олександровича: усі столики на веранді, природно, виявились вже позайманими, і довелось залишатися вечеряти у цих красивих, але душних залях.	доведеться
1040	RU	– Ты , – оскалившись , перебил Иван , – понимаешь ли , что надо поймать профессора ?	надо
1040	EN	 You , ' Ivan interrupted , baring his teeth , " but do n't you understand that the professor has to be caught ?	have to
1040	DE	 Du  , unterbrach ihn Iwan zähnefletschend , " kapierst du nicht , daß man den Professor fangen muß ?	müssen
1040	IT	- Tu, - lo interruppe Ivan digrignando i denti, - lo capisci che bisogna prendere il professore?	bisognare
1040	ES	—Pero ¿no te das cuenta que hace falta atrapar al profesor?	haber
1040	FR	– Tu ne comprends pas, coupa Ivan en montrant les dents, qu’il faut attraper le professeur ?	il faut
1040	UK	— Ти, — вишкірившись, перебив Іван, — чи розумієш, що треба зловити професора?	треба
1142	RU	– Да при чем здесь « толкнул » ? – сердясь на общую бестолковость , воскликнул Иван , – такому и толкать не надо !	надо
1142	EN	 " Pushed him " , nothing ! ' Ivan exclaimed , angered by the general obtuseness . ' His kind do n't need to push !	need to
1142	DE	 Wieso denn gestoßen ?  rief Iwan , ungehalten über die allgemeine Begriffsstutzigkeit . " So was hat der gar nicht nötig !	nötig
1142	IT	- Che c'entra la «spinta»? - esclamò Ivan, infuriandosi per la stupidità generale. - Uno come lui non ha bisogno di spingere!	avere bisogno
1142	ES	—Pero ¿por qué «empujó»? —exclamó Iván irritado por la torpeza general—. Ese no tiene ni que molestarse en empujar.	tener que
1142	FR	– Qui vous parle de « pousser » ? s’écria Ivan, irrité par cette sottise générale. Est-ce que vous vous figurez qu’il a besoin de pousser, lui ?	il a besoin
